state,local_id,siteid,sitename,sitename_long,sitename_10,lat,lon,infra_type,road_type,dir,location_type,location_detail,orientation,count_type,mfgr,asset_owner,notes
WA,51610,51610,Stirling Hwy RSP (Stirling Bridge),Stirling Hwy RSP at Stirling Bridge,StirlingHy,-32.040838,115.761146,,,,,,,,MetroCount,Main Roads Western Australia,
WA,51620,51620,Mount St RSP,Mount St RSP bridge,MountSt,-31.953755,115.84904,,,,,,,,MetroCount,Main Roads Western Australia,
WA,51624,51624,Queen Victoria St RSP (Fremantle Bridge),Queen Victoria St RSP S of Fremantle Traffic Bridge,QueenVicSt,-32.042517,115.754634,,,,,,,,MetroCount,Main Roads Western Australia,
WA,51626,51626,West Coast Dr (The Plaza),West Coast Dr N of The Plaza,WestCstDr,-31.831169,115.746379,,,,,,,,,,
WA,51661,51661,Fremantle Roundhouse RSP,Fremantle Roundhouse RSP,FreRndRSP,-32.05645,115.741711,,,,,,,,,,
WA,51825,51825,Hollis Park RSP,Hollis Park RSP E of Daly St,HollisPk,-32.076508,115.758133,,,,,,,,,,
WA,52028,52028,Airport Dr PSP,Airport Dr PSP N of Tonkin Hwy PSP,AirportDr,-31.965276,115.95658,,,,,,,,,,
WA,52029,52029,Tonkin Hwy PSP (East of Leach Hwy),Tonkin Hwy PSP E of Airport Dr PSP,TonkinApt,-31.969524,115.956529,,,,,,,,,,
WA,52032,52032,Tonkin Hwy PSP (West of Leach Hwy),Tonkin Hwy PSP S of Whiteside St,TonkinWhit,-31.964134,115.952762,,,,,,,,,,
WA,52033,52033,Leach Hwy PSP,Leach Hwy PSP N of Fisher St,LeachHwy,-31.970527,115.95121,,,,,,,,,,
WA,52036,52036,Guildford PSP,Guildford PSP W of Morrison Rd,Guildford,-31.890971,115.99493,,,,,,,,,,
WA,52257,52257,Tonkin Hwy PSP (East of Chisholm Cr),Tonkin Hwy PSP (East of Chisholm Cr),TonkinChis,-31.989885,115.984397,,,,,,,,,,
WA,52258,52258,Roe Hwy PSP (South of Pavetta Cr),Roe Hwy PSP (South of Pavetta Cr),RoeHwyPav,-31.972815,115.998442,,,,,,,,,,
WA,52274,52274,Old Coast Rd PSP,Old Coast Rd PSP (North of Estuary Dr),OldCoast,,,,,,,,,,,,
WA,52275,52275,Parade Rd PSP,Parade Rd PSP (South of Payton Way),Parade,,,,,,,,,,,,
WA,52276,52276,Bussell Hwy RSP,Bussell Hwy RSP (South of Washington Av),Bussell,,,,,,,,,,,,
Tas,,,Intercity Cycleway (Navy Club),,,-42.874855,147.335061,2,0,9,1,1,1,1,MetroCount,Hobart City Council,
